{"daily_source_method":"CebonkAstroWeekly.days[].dominant","expires_at_utc":1792824723,"generated_at_utc":1792716723,"horizon_end_wib":"2026-10-30","horizon_start_wib":"2026-10-23","liquidity_sessions":[{"end_utc":1792368000,"session_id":"sydney","start_utc":1792357200},{"end_utc":1792378800,"session_id":"tokyo","start_utc":1792368000},{"end_utc":1792404000,"session_id":"london","start_utc":1792393200},{"end_utc":1792422000,"session_id":"newyork","start_utc":1792411200},{"end_utc":1792425600,"session_id":"londonclose","start_utc":1792418400},{"end_utc":1792454400,"session_id":"sydney","start_utc":1792443600},{"end_utc":1792465200,"session_id":"tokyo","start_utc":1792454400},{"end_utc":1792490400,"session_id":"london","start_utc":1792479600},{"end_utc":1792508400,"session_id":"newyork","start_utc":1792497600},{"end_utc":1792512000,"session_id":"londonclose","start_utc":1792504800},{"end_utc":1792540800,"session_id":"sydney","start_utc":1792530000},{"end_utc":1792551600,"session_id":"tokyo","start_utc":1792540800},{"end_utc":1792576800,"session_id":"london","start_utc":1792566000},{"end_utc":1792594800,"session_id":"newyork","start_utc":1792584000},{"end_utc":1792598400,"session_id":"londonclose","start_utc":1792591200},{"end_utc":1792627200,"session_id":"sydney","start_utc":1792616400},{"end_utc":1792638000,"session_id":"tokyo","start_utc":1792627200},{"end_utc":1792663200,"session_id":"london","start_utc":1792652400},{"end_utc":1792681200,"session_id":"newyork","start_utc":1792670400},{"end_utc":1792684800,"session_id":"londonclose","start_utc":1792677600},{"end_utc":1792713600,"session_id":"sydney","start_utc":1792702800},{"end_utc":1792724400,"session_id":"tokyo","start_utc":1792713600},{"end_utc":1792749600,"session_id":"london","start_utc":1792738800},{"end_utc":1792767600,"session_id":"newyork","start_utc":1792756800},{"end_utc":1792771200,"session_id":"londonclose","start_utc":1792764000},{"end_utc":1792972800,"session_id":"sydney","start_utc":1792962000},{"end_utc":1792983600,"session_id":"tokyo","start_utc":1792972800},{"end_utc":1793012400,"session_id":"london","start_utc":1793001600},{"end_utc":1793026800,"session_id":"newyork","start_utc":1793016000},{"end_utc":1793034000,"session_id":"londonclose","start_utc":1793026800},{"end_utc":1793059200,"session_id":"sydney","start_utc":1793048400},{"end_utc":1793070000,"session_id":"tokyo","start_utc":1793059200},{"end_utc":1793098800,"session_id":"london","start_utc":1793088000},{"end_utc":1793113200,"session_id":"newyork","start_utc":1793102400},{"end_utc":1793120400,"session_id":"londonclose","start_utc":1793113200},{"end_utc":1793145600,"session_id":"sydney","start_utc":1793134800},{"end_utc":1793156400,"session_id":"tokyo","start_utc":1793145600},{"end_utc":1793185200,"session_id":"london","start_utc":1793174400},{"end_utc":1793199600,"session_id":"newyork","start_utc":1793188800},{"end_utc":1793206800,"session_id":"londonclose","start_utc":1793199600},{"end_utc":1793232000,"session_id":"sydney","start_utc":1793221200},{"end_utc":1793242800,"session_id":"tokyo","start_utc":1793232000},{"end_utc":1793271600,"session_id":"london","start_utc":1793260800},{"end_utc":1793286000,"session_id":"newyork","start_utc":1793275200},{"end_utc":1793293200,"session_id":"londonclose","start_utc":1793286000},{"end_utc":1793318400,"session_id":"sydney","start_utc":1793307600},{"end_utc":1793329200,"session_id":"tokyo","start_utc":1793318400},{"end_utc":1793358000,"session_id":"london","start_utc":1793347200},{"end_utc":1793372400,"session_id":"newyork","start_utc":1793361600},{"end_utc":1793379600,"session_id":"londonclose","start_utc":1793372400}],"lunar_rank_broker_mode":"AUTO_NY_CLOSE_ESTIMATE_00:00_ANNOTATION_ONLY","m5_model":"MUSANG_EL2_IB_CB1_RETEST","model_id":"CEBONK_SWING_ASTRO_WEEKLY_LOCK_7D_V1","moon":{"algorithm":"astronomy-engine@2.1.19","major_events":[{"event_at_utc":1790441372,"phase":"FULL_MOON"},{"event_at_utc":1791033933,"phase":"LAST_QUARTER"},{"event_at_utc":1791647436,"phase":"NEW_MOON"},{"event_at_utc":1792339999,"phase":"FIRST_QUARTER"},{"event_at_utc":1792987935,"phase":"FULL_MOON"},{"event_at_utc":1793564938,"phase":"LAST_QUARTER"},{"event_at_utc":1794207762,"phase":"NEW_MOON"},{"event_at_utc":1794916107,"phase":"FIRST_QUARTER"},{"event_at_utc":1795532044,"phase":"FULL_MOON"},{"event_at_utc":1796105354,"phase":"LAST_QUARTER"},{"event_at_utc":1796777551,"phase":"NEW_MOON"},{"event_at_utc":1797486194,"phase":"FIRST_QUARTER"},{"event_at_utc":1798075725,"phase":"FULL_MOON"},{"event_at_utc":1798657207,"phase":"LAST_QUARTER"}],"samples":[{"illumination_pct":85.9138342983123,"observed_at_utc":1792688400,"phase":"WAXING_GIBBOUS","phase_angle":135.82929292174038},{"illumination_pct":86.21539882773587,"observed_at_utc":1792692000,"phase":"WAXING_GIBBOUS","phase_angle":136.33084906404525},{"illumination_pct":86.51458393795949,"observed_at_utc":1792695600,"phase":"WAXING_GIBBOUS","phase_angle":136.83311751422363},{"illumination_pct":86.81135620202684,"observed_at_utc":1792699200,"phase":"WAXING_GIBBOUS","phase_angle":137.33610064380105},{"illumination_pct":87.10568211303868,"observed_at_utc":1792702800,"phase":"WAXING_GIBBOUS","phase_angle":137.83980072379993},{"illumination_pct":87.3975280895255,"observed_at_utc":1792706400,"phase":"WAXING_GIBBOUS","phase_angle":138.34421992341237},{"illumination_pct":87.6868604810543,"observed_at_utc":1792710000,"phase":"WAXING_GIBBOUS","phase_angle":138.84936030880507},{"illumination_pct":87.97364557394778,"observed_at_utc":1792713600,"phase":"WAXING_GIBBOUS","phase_angle":139.35522384185282},{"illumination_pct":88.25784959721517,"observed_at_utc":1792717200,"phase":"WAXING_GIBBOUS","phase_angle":139.8618123789733},{"illumination_pct":88.53943872854458,"observed_at_utc":1792720800,"phase":"WAXING_GIBBOUS","phase_angle":140.3691276697964},{"illumination_pct":88.81837910055354,"observed_at_utc":1792724400,"phase":"WAXING_GIBBOUS","phase_angle":140.87717135601858},{"illumination_pct":89.09463680718521,"observed_at_utc":1792728000,"phase":"WAXING_GIBBOUS","phase_angle":141.385944970247},{"illumination_pct":89.36817791020906,"observed_at_utc":1792731600,"phase":"WAXING_GIBBOUS","phase_angle":141.89544993475695},{"illumination_pct":89.63896844594198,"observed_at_utc":1792735200,"phase":"WAXING_GIBBOUS","phase_angle":142.40568756037507},{"illumination_pct":89.90697443206707,"observed_at_utc":1792738800,"phase":"WAXING_GIBBOUS","phase_angle":142.91665904526522},{"illumination_pct":90.17216187467413,"observed_at_utc":1792742400,"phase":"WAXING_GIBBOUS","phase_angle":143.42836547385116},{"illumination_pct":90.43449677540355,"observed_at_utc":1792746000,"phase":"WAXING_GIBBOUS","phase_angle":143.9408078156536},{"illumination_pct":90.69394513884848,"observed_at_utc":1792749600,"phase":"WAXING_GIBBOUS","phase_angle":144.45398692434827},{"illumination_pct":90.95047297989743,"observed_at_utc":1792753200,"phase":"WAXING_GIBBOUS","phase_angle":144.9679035364229},{"illumination_pct":91.20404633149033,"observed_at_utc":1792756800,"phase":"WAXING_GIBBOUS","phase_angle":145.48255827036385},{"illumination_pct":91.45463125232304,"observed_at_utc":1792760400,"phase":"WAXING_GIBBOUS","phase_angle":145.99795162546496},{"illumination_pct":91.70219383480503,"observed_at_utc":1792764000,"phase":"WAXING_GIBBOUS","phase_angle":146.5140839808613},{"illumination_pct":91.94670021317756,"observed_at_utc":1792767600,"phase":"WAXING_GIBBOUS","phase_angle":147.03095559461494},{"illumination_pct":92.18811657167574,"observed_at_utc":1792771200,"phase":"WAXING_GIBBOUS","phase_angle":147.54856660261223},{"illumination_pct":92.42640915293987,"observed_at_utc":1792774800,"phase":"WAXING_GIBBOUS","phase_angle":148.06691701770453},{"illumination_pct":92.66154426650701,"observed_at_utc":1792778400,"phase":"WAXING_GIBBOUS","phase_angle":148.58600672874263},{"illumination_pct":92.8934882975291,"observed_at_utc":1792782000,"phase":"WAXING_GIBBOUS","phase_angle":149.10583549983332},{"illumination_pct":93.122207715465,"observed_at_utc":1792785600,"phase":"WAXING_GIBBOUS","phase_angle":149.626402969263},{"illumination_pct":93.34766908302579,"observed_at_utc":1792789200,"phase":"WAXING_GIBBOUS","phase_angle":150.147708648706},{"illumination_pct":93.56983906533591,"observed_at_utc":1792792800,"phase":"WAXING_GIBBOUS","phase_angle":150.6697519226686},{"illumination_pct":93.78868443895941,"observed_at_utc":1792796400,"phase":"WAXING_GIBBOUS","phase_angle":151.19253204735625},{"illumination_pct":94.00417210132083,"observed_at_utc":1792800000,"phase":"WAXING_GIBBOUS","phase_angle":151.7160481501925},{"illumination_pct":94.21626908009054,"observed_at_utc":1792803600,"phase":"WAXING_GIBBOUS","phase_angle":152.240299229012},{"illumination_pct":94.42494254273898,"observed_at_utc":1792807200,"phase":"WAXING_GIBBOUS","phase_angle":152.76528415140217},{"illumination_pct":94.63015980619728,"observed_at_utc":1792810800,"phase":"WAXING_GIBBOUS","phase_angle":153.29100165406211},{"illumination_pct":94.83188834660771,"observed_at_utc":1792814400,"phase":"WAXING_GIBBOUS","phase_angle":153.81745034214376},{"illumination_pct":95.03009580924851,"observed_at_utc":1792818000,"phase":"WAXING_GIBBOUS","phase_angle":154.34462868880738},{"illumination_pct":95.22475001846603,"observed_at_utc":1792821600,"phase":"WAXING_GIBBOUS","phase_angle":154.87253503456654},{"illumination_pct":95.41581898781068,"observed_at_utc":1792825200,"phase":"WAXING_GIBBOUS","phase_angle":155.40116758695672},{"illumination_pct":95.60327093014568,"observed_at_utc":1792828800,"phase":"WAXING_GIBBOUS","phase_angle":155.93052441991958},{"illumination_pct":95.78707426792081,"observed_at_utc":1792832400,"phase":"WAXING_GIBBOUS","phase_angle":156.46060347342805},{"illumination_pct":95.9671976435518,"observed_at_utc":1792836000,"phase":"WAXING_GIBBOUS","phase_angle":156.99140255322664},{"illumination_pct":96.14360992979778,"observed_at_utc":1792839600,"phase":"FULL_MOON","phase_angle":157.52291933038106},{"illumination_pct":96.31628